----------------------------------------------------------------------------
CrystalDiskInfo 8.17.14 Shizuku Edition x64 (C) 2008-2022 hiyohiyo
                                Crystal Dew World: https://crystalmark.info/
----------------------------------------------------------------------------

    OS : Windows 10 Professional [10.0 Build 19045] (x64)
  Date : 2026/07/18 9:05:26

-- Controller Map ----------------------------------------------------------
 + Intel(R) 300 Series Chipset Family SATA AHCI Controller [ATA]
   - KIOXIA-EXCERIA SATA SSD
   - WD Blue SA510 2.5 500GB SSD
 - Microsoft 存储空间控制器 [SCSI]
 + Microsoft VHD 环回控制器 [SCSI]
   - Microsoft 虚拟磁盘

-- Disk List ---------------------------------------------------------------
 (01) KIOXIA-EXCERIA SATA SSD : 960.1 GB [0/0/1, pd1] - ki
 (02) WD Blue SA510 2.5 500GB SSD : 500.1 GB [1/0/2, pd1] - wd

----------------------------------------------------------------------------
 (01) KIOXIA-EXCERIA SATA SSD
----------------------------------------------------------------------------
           Model : KIOXIA-EXCERIA SATA SSD
        Firmware : SBFA1a.1
   Serial Number : 62EB81QRK0Z5
       Disk Size : 960.1 GB (8.4/137.4/960.1/----)
     Buffer Size : 未知
     Queue Depth : 32
    # of Sectors : 1875385008
   Rotation Rate : ---- (SSD)
       Interface : Serial ATA
   Major Version : ACS-4
   Minor Version : ----
   Transfer Mode : SATA/600 | SATA/600
  Power On Hours : 30870 小时
  Power On Count : 218 次
     Host Writes : 12412 GB
     Temperature : 34 C (93 F)
   Health Status : 良好 (96 %)
        Features : S.M.A.R.T., NCQ, TRIM, DevSleep, GPL
       APM Level : ----
       AAM Level : ----
    Drive Letter : D:

-- S.M.A.R.T. --------------------------------------------------------------
ID Cur Wor Thr RawValues(6) Attribute Name
09 100 100 __0 000000007896 通电时间(小时)
0C 100 100 __0 0000000000DA 通电次数
A7 100 100 __0 000000000000 固态硬盘保护模式 (只读不写)
A8 100 100 __0 000000000000 SATA 物理层错误计数
A9 100 100 _10 000000000000 坏块计数
AD 196 196 __0 000000000000 擦除计数 (用户数据)
C0 100 100 __0 00000000000C 意外断电计数
C2 _66 _56 _20 002C00130022 温度
F1 100 100 __0 000000060F8A 主机写入

-- IDENTIFY_DEVICE ---------------------------------------------------------
        0    1    2    3    4    5    6    7    8    9
000: 0040 3FFF C837 0010 0000 0000 003F 0000 0000 0000
010: 3632 4542 3831 5152 4B30 5A35 2020 2020 2020 2020
020: 0000 0000 0000 5342 4641 3161 2E31 4B49 4F58 4941
030: 2D45 5843 4552 4941 2053 4154 4120 5353 4420 2020
040: 2020 2020 2020 2020 2020 2020 2020 8010 4000 2F00
050: 4000 0000 0000 0007 3FFF 0010 003F FC10 00FB 0110
060: FFFF 0FFF 0000 0007 0003 0078 0078 0078 0078 0F00
070: 0000 0000 0000 0000 0000 001F 850E 0086 014C 004C
080: 0FF8 0000 746B 7501 4161 7469 B401 4161 407F 000A
090: 001E 0000 FFFE 0000 0000 0000 0000 0000 0000 0000
100: 1AB0 6FC8 0000 0000 0000 0008 4000 0000 58CE 38EC
110: 01DA B1BE 0000 0000 0000 0000 0000 0000 0000 4018
120: 4018 0000 0000 0000 0000 0000 0000 0000 0029 0000
130: 0000 0000 0000 0000 0000 0000 0000 0000 0000 0000
140: 0000 0000 0000 0000 0000 0000 0000 0000 0000 0000
150: 0000 0000 0000 0000 0000 0000 0000 0000 0000 0000
160: 0000 0000 0000 0000 0000 0000 0000 0000 0003 0001
170: 0000 0000 0000 0000 0000 0000 0000 0000 0000 0000
180: 0000 0000 0000 0000 0000 0000 0000 0000 0000 0000
190: 0000 0000 0000 0000 0000 0000 0000 0000 0000 0000
200: 0000 0000 0000 0000 0000 0000 0000 0000 0000 4000
210: 0000 0000 0000 0000 0000 0000 0000 0001 0000 0000
220: 0000 0000 10FF 0000 0000 0000 0000 0000 0000 0000
230: 0000 0000 0000 0000 0001 FFFE 0000 0000 0000 0000
240: 0000 0000 0000 0000 0000 0000 0000 0000 0000 0000
250: 0000 0000 0000 0000 0000 38A5

-- SMART_READ_DATA ---------------------------------------------------------
     +0 +1 +2 +3 +4 +5 +6 +7 +8 +9 +A +B +C +D +E +F
000: 10 00 09 12 00 64 64 96 78 00 00 00 00 00 0C 12
010: 00 64 64 DA 00 00 00 00 00 00 A7 22 00 64 64 00
020: 00 00 00 00 00 00 A8 12 00 64 64 00 00 00 00 00
030: 00 00 A9 03 00 64 64 00 00 00 00 00 00 00 AD 12
040: 00 C4 C4 00 00 00 00 00 00 00 C0 12 00 64 64 0C
050: 00 00 00 00 00 00 C2 23 00 42 38 22 00 13 00 2C
060: 00 00 F1 32 00 64 64 8A 0F 06 00 00 00 00 00 00
070: 00 00 00 00 00 00 00 00 00 00 00 00 00 00 00 00
080: 00 00 00 00 00 00 00 00 00 00 00 00 00 00 00 00
090: 00 00 00 00 00 00 00 00 00 00 00 00 00 00 00 00
0A0: 00 00 00 00 00 00 00 00 00 00 00 00 00 00 00 00
0B0: 00 00 00 00 00 00 00 00 00 00 00 00 00 00 00 00
0C0: 00 00 00 00 00 00 00 00 00 00 00 00 00 00 00 00
0D0: 00 00 00 00 00 00 00 00 00 00 00 00 00 00 00 00
0E0: 00 00 00 00 00 00 00 00 00 00 00 00 00 00 00 00
0F0: 00 00 00 00 00 00 00 00 00 00 00 00 00 00 00 00
100: 00 00 00 00 00 00 00 00 00 00 00 00 00 00 00 00
110: 00 00 00 00 00 00 00 00 00 00 00 00 00 00 00 00
120: 00 00 00 00 00 00 00 00 00 00 00 00 00 00 00 00
130: 00 00 00 00 00 00 00 00 00 00 00 00 00 00 00 00
140: 00 00 00 00 00 00 00 00 00 00 00 00 00 00 00 00
150: 00 00 00 00 00 00 00 00 00 00 00 00 00 00 00 00
160: 00 00 00 00 00 00 00 00 00 00 00 00 1E 00 00 00
170: 03 00 01 00 02 1E 06 1E 00 00 00 00 00 00 00 00
180: 00 00 00 00 00 00 00 00 00 00 00 00 00 00 00 00
190: 00 00 00 00 00 00 00 00 00 00 00 00 00 00 00 00
1A0: 00 00 00 00 00 00 00 00 00 00 00 00 00 00 00 00
1B0: 00 00 00 00 00 00 00 00 00 00 00 00 00 00 00 00
1C0: 00 00 00 00 00 00 00 00 00 00 00 00 00 00 00 00
1D0: 00 00 00 00 00 00 00 00 00 00 00 00 00 00 00 00
1E0: 00 00 00 00 00 00 00 00 00 00 00 00 00 00 00 00
1F0: 00 00 00 00 00 00 00 00 00 00 00 00 00 00 00 1B

-- SMART_READ_THRESHOLD ----------------------------------------------------
     +0 +1 +2 +3 +4 +5 +6 +7 +8 +9 +A +B +C +D +E +F
000: 10 00 09 00 00 00 00 00 00 00 00 00 00 00 0C 00
010: 00 00 00 00 00 00 00 00 00 00 A7 00 00 00 00 00
020: 00 00 00 00 00 00 A8 00 00 00 00 00 00 00 00 00
030: 00 00 A9 0A 00 00 00 00 00 00 00 00 00 00 AD 00
040: 00 00 00 00 00 00 00 00 00 00 C0 00 00 00 00 00
050: 00 00 00 00 00 00 C2 14 00 00 00 00 00 00 00 00
060: 00 00 F1 00 00 00 00 00 00 00 00 00 00 00 00 00
070: 00 00 00 00 00 00 00 00 00 00 00 00 00 00 00 00
080: 00 00 00 00 00 00 00 00 00 00 00 00 00 00 00 00
090: 00 00 00 00 00 00 00 00 00 00 00 00 00 00 00 00
0A0: 00 00 00 00 00 00 00 00 00 00 00 00 00 00 00 00
0B0: 00 00 00 00 00 00 00 00 00 00 00 00 00 00 00 00
0C0: 00 00 00 00 00 00 00 00 00 00 00 00 00 00 00 00
0D0: 00 00 00 00 00 00 00 00 00 00 00 00 00 00 00 00
0E0: 00 00 00 00 00 00 00 00 00 00 00 00 00 00 00 00
0F0: 00 00 00 00 00 00 00 00 00 00 00 00 00 00 00 00
100: 00 00 00 00 00 00 00 00 00 00 00 00 00 00 00 00
110: 00 00 00 00 00 00 00 00 00 00 00 00 00 00 00 00
120: 00 00 00 00 00 00 00 00 00 00 00 00 00 00 00 00
130: 00 00 00 00 00 00 00 00 00 00 00 00 00 00 00 00
140: 00 00 00 00 00 00 00 00 00 00 00 00 00 00 00 00
150: 00 00 00 00 00 00 00 00 00 00 00 00 00 00 00 00
160: 00 00 00 00 00 00 00 00 00 00 00 00 00 00 00 00
170: 00 00 00 00 00 00 00 00 00 00 00 00 00 00 00 00
180: 00 00 00 00 00 00 00 00 00 00 00 00 00 00 00 00
190: 00 00 00 00 00 00 00 00 00 00 00 00 00 00 00 00
1A0: 00 00 00 00 00 00 00 00 00 00 00 00 00 00 00 00
1B0: 00 00 00 00 00 00 00 00 00 00 00 00 00 00 00 00
1C0: 00 00 00 00 00 00 00 00 00 00 00 00 00 00 00 00
1D0: 00 00 00 00 00 00 00 00 00 00 00 00 00 00 00 00
1E0: 00 00 00 00 00 00 00 00 00 00 00 00 00 00 00 00
1F0: 00 00 00 00 00 00 00 00 00 00 00 00 00 00 00 A5

----------------------------------------------------------------------------
 (02) WD Blue SA510 2.5 500GB SSD
----------------------------------------------------------------------------
           Model : WD Blue SA510 2.5 500GB SSD
        Firmware : 52020100
   Serial Number : 23010U802167
       Disk Size : 500.1 GB (8.4/137.4/500.1/----)
     Buffer Size : 未知
     Queue Depth : 32
    # of Sectors : 976773168
   Rotation Rate : ---- (SSD)
       Interface : Serial ATA
   Major Version : ACS-4
   Minor Version : ACS-2 Revision 3
   Transfer Mode : SATA/600 | SATA/600
  Power On Hours : 4670 小时
  Power On Count : 4200 次
      Host Reads : 13631 GB
     Host Writes : 12153 GB
     NAND Writes : 5928 GB
     Temperature : 35 C (95 F)
   Health Status : 良好 (98 %)
        Features : S.M.A.R.T., APM, NCQ, TRIM, DevSleep, GPL
       APM Level : 0080h [ON]
       AAM Level : ----
    Drive Letter : C:

-- S.M.A.R.T. --------------------------------------------------------------
ID Cur Wor Thr RawValues(6) Attribute Name
05 100 100 _10 000000000000 重新分配块计数
09 100 100 __0 00000000123E 通电时间(小时)
0C 100 100 __0 000000001068 通电次数
A5 100 100 __0 04E8083E0837 块擦除计数 (SLC)
A6 100 100 __0 000000000005 最小 PE(编程/擦除) 次数
A7 100 100 __0 000000000011 单个裸片中坏块数 (最大)
A8 100 100 __0 000000000015 最大 PE(编程/擦除) 次数
A9 100 100 __0 000000000051 坏块总计
AA 100 100 __0 000000000000 新增坏块
AB 100 100 __0 000000000000 编程失败计数
AC 100 100 __0 000000000000 擦除失败计数
AD 100 100 __5 00000000000D 平均 PE(编程/擦除) 次数
AE 100 100 __0 000000001038 意外断电计数
B8 100 100 _97 000000000000 端到端错误检测/校正计数
BB 100 100 __0 000000000000 报告的不可校正的错误
BC 100 100 __0 000000000001 命令超时计数
C2 100 100 _14 002800140023 温度
C7 100 100 __0 000000000000 CRC 错误计数
E6 100 100 __0 025000560250 介质磨损指示器
E8 100 100 __4 00000000005D 剩余备用块
E9 100 100 __0 000000001728 NAND 总计写入
EA 100 100 __0 000000005C8A NAND 总计写入 (SLC)
F1 253 253 __0 000000002F79 总计写入 (GB)
F2 253 253 __0 00000000353F 总计读取 (GB)
F4 100 100 __0 000000000000 温控状态

-- IDENTIFY_DEVICE ---------------------------------------------------------
        0    1    2    3    4    5    6    7    8    9
000: 0040 3FFF C837 0010 0000 0000 003F 0000 0000 0000
010: 3233 3031 3055 3830 3231 3637 2020 2020 2020 2020
020: 0000 0000 0000 3532 3032 3031 3030 5744 2042 6C75
030: 6520 5341 3531 3020 322E 3520 3530 3047 4220 5353
040: 4420 2020 2020 2020 2020 2020 2020 8001 4000 2F00
050: 4000 0000 0000 0006 3FFF 0010 003F FC10 00FB 9D01
060: FFFF 0FFF 0000 0007 0003 0078 0078 0078 0078 4F00
070: 0000 0000 0000 0000 0000 001F 850E 0006 054C 004C
080: 0FF0 0110 306B 7509 4123 3469 B409 4123 407F 800A
090: 0000 0080 FFFE 0000 0000 0000 0000 0000 0000 0000
100: 6030 3A38 0000 0000 0000 0008 4000 0000 5001 B448
110: BD3B 2D72 0000 0000 0000 0000 0000 0000 0000 411C
120: 401C 0000 0000 0000 0000 0000 0000 0000 0009 0000
130: 0000 0000 0000 0000 0000 0000 0000 0000 0000 0000
140: 0000 0000 0000 0000 0000 0000 0000 0000 0000 0000
150: 0000 0000 0000 0000 0000 0000 0000 0000 0000 0000
160: 0000 0000 0000 0000 0000 0000 0000 0000 0003 0001
170: 2020 2020 2020 2020 0000 0000 0000 0000 0000 0000
180: 0000 0000 0000 0000 0000 0000 0000 0000 0000 0000
190: 0000 0000 0000 0000 0000 0000 0000 0000 0000 0000
200: 0000 0000 0000 0000 0000 0000 0000 0000 0000 4000
210: 0000 0000 0000 0000 0000 0000 0000 0001 0000 0000
220: 0000 0000 10FF 0000 0000 0000 0000 0000 0000 0000
230: 0000 0000 0000 0000 0008 0008 0000 0000 0000 0000
240: 0000 0000 0000 0000 0000 0000 0000 0000 0000 0000
250: 0000 0000 0000 0000 0000 F1A5

-- SMART_READ_DATA ---------------------------------------------------------
     +0 +1 +2 +3 +4 +5 +6 +7 +8 +9 +A +B +C +D +E +F
000: 00 00 05 32 00 64 64 00 00 00 00 00 00 00 09 32
010: 00 64 64 3E 12 00 00 00 00 00 0C 32 00 64 64 68
020: 10 00 00 00 00 00 A5 32 00 64 64 37 08 3E 08 E8
030: 04 00 A6 32 00 64 64 05 00 00 00 00 00 00 A7 32
040: 00 64 64 11 00 00 00 00 00 00 A8 32 00 64 64 15
050: 00 00 00 00 00 00 A9 32 00 64 64 51 00 00 00 00
060: 00 00 AA 32 00 64 64 00 00 00 00 00 00 00 AB 32
070: 00 64 64 00 00 00 00 00 00 00 AC 32 00 64 64 00
080: 00 00 00 00 00 00 AD 32 00 64 64 0D 00 00 00 00
090: 00 00 AE 32 00 64 64 38 10 00 00 00 00 00 B8 32
0A0: 00 64 64 00 00 00 00 00 00 00 BB 32 00 64 64 00
0B0: 00 00 00 00 00 00 BC 32 00 64 64 01 00 00 00 00
0C0: 00 00 C2 22 00 64 64 23 00 14 00 28 00 00 C7 32
0D0: 00 64 64 00 00 00 00 00 00 00 E6 32 00 64 64 50
0E0: 02 56 00 50 02 00 E8 33 00 64 64 5D 00 00 00 00
0F0: 00 04 E9 32 00 64 64 28 17 00 00 00 00 00 EA 32
100: 00 64 64 8A 5C 00 00 00 00 00 F1 30 00 FD FD 79
110: 2F 00 00 00 00 00 F2 30 00 FD FD 3F 35 00 00 00
120: 00 00 F4 32 00 64 64 00 00 00 00 00 00 00 00 00
130: 00 00 00 00 00 00 00 00 00 00 00 00 00 00 00 00
140: 00 00 00 00 00 00 00 00 00 00 00 00 00 00 00 00
150: 00 00 00 00 00 00 00 00 00 00 00 00 00 00 00 00
160: 00 00 00 00 00 00 00 00 00 00 00 00 00 00 00 71
170: 03 00 01 00 01 0A 01 00 00 00 00 00 00 00 00 00
180: 00 00 00 00 00 00 00 00 00 00 00 00 00 00 00 00
190: 00 00 00 00 00 00 00 00 00 00 00 00 00 00 00 00
1A0: 00 00 00 00 00 00 00 00 00 00 00 00 00 00 00 00
1B0: 00 00 00 00 00 00 00 00 00 00 00 00 00 00 00 00
1C0: 00 00 00 00 00 00 00 00 00 00 00 00 00 00 00 00
1D0: 00 00 00 00 00 00 00 00 00 00 00 00 00 00 00 00
1E0: 00 00 00 00 00 00 00 00 00 00 00 00 00 00 00 00
1F0: 00 00 00 00 00 00 00 00 00 00 00 00 00 00 00 D5

-- SMART_READ_THRESHOLD ----------------------------------------------------
     +0 +1 +2 +3 +4 +5 +6 +7 +8 +9 +A +B +C +D +E +F
000: 01 00 05 0A 00 00 00 00 00 00 00 00 00 00 09 00
010: 00 00 00 00 00 00 00 00 00 00 0C 00 00 00 00 00
020: 00 00 00 00 00 00 A5 00 00 00 00 00 00 00 00 00
030: 00 00 A6 00 00 00 00 00 00 00 00 00 00 00 A7 00
040: 00 00 00 00 00 00 00 00 00 00 A8 00 00 00 00 00
050: 00 00 00 00 00 00 A9 00 00 00 00 00 00 00 00 00
060: 00 00 AA 00 00 00 00 00 00 00 00 00 00 00 AB 00
070: 00 00 00 00 00 00 00 00 00 00 AC 00 00 00 00 00
080: 00 00 00 00 00 00 AD 05 00 00 00 00 00 00 00 00
090: 00 00 AE 00 00 00 00 00 00 00 00 00 00 00 B8 61
0A0: 00 00 00 00 00 00 00 00 00 00 BB 00 00 00 00 00
0B0: 00 00 00 00 00 00 BC 00 00 00 00 00 00 00 00 00
0C0: 00 00 C2 0E 00 00 00 00 00 00 00 00 00 00 C7 00
0D0: 00 00 00 00 00 00 00 00 00 00 E6 00 00 00 00 00
0E0: 00 00 00 00 00 00 E8 04 00 00 00 00 00 00 00 00
0F0: 00 00 E9 00 00 00 00 00 00 00 00 00 00 00 EA 00
100: 00 00 00 00 00 00 00 00 00 00 F1 00 00 00 00 00
110: 00 00 00 00 00 00 F2 00 00 00 00 00 00 00 00 00
120: 00 00 F4 00 00 00 00 00 00 00 00 00 00 00 00 00
130: 00 00 00 00 00 00 00 00 00 00 00 00 00 00 00 00
140: 00 00 00 00 00 00 00 00 00 00 00 00 00 00 00 00
150: 00 00 00 00 00 00 00 00 00 00 00 00 00 00 00 00
160: 00 00 00 00 00 00 00 00 00 00 00 00 00 00 00 00
170: 00 00 00 00 00 00 00 00 00 00 00 00 00 00 00 00
180: 00 00 00 00 00 00 00 00 00 00 00 00 00 00 00 00
190: 00 00 00 00 00 00 00 00 00 00 00 00 00 00 00 00
1A0: 00 00 00 00 00 00 00 00 00 00 00 00 00 00 00 00
1B0: 00 00 00 00 00 00 00 00 00 00 00 00 00 00 00 00
1C0: 00 00 00 00 00 00 00 00 00 00 00 00 00 00 00 00
1D0: 00 00 00 00 00 00 00 00 00 00 00 00 00 00 00 00
1E0: 00 00 00 00 00 00 00 00 00 00 00 00 00 00 00 00
1F0: 00 00 00 00 00 00 00 00 00 00 00 00 00 00 00 94

